{
  "projectId": "blacklight-exo-vessel-design-system",
  "registryType": "blackLightFtlUpgradeCausalityRegistry",
  "registryVersion": "1.0.0",
  "authorityDocument": "docs/blacklight/BLACK_LIGHT_PROPULSION_TRANSIT_AUTHORITY.md",
  "mathematicalModelRegistry": "data/exo-vessel/ftl-mathematical-model-registry.json",
  "sourceRequirements": {
    "sourceTitle": "The different lightspeed methods",
    "status": "CONFIRMED_DESIGN_REQUIREMENT",
    "requirements": [
      "Each transit family must have distinct gravity-sensitivity, miscalculation, efficiency-loss, route-hazard and emergency de-transit behavior.",
      "Near sufficiently large gravity wells, imposed spacetime manipulation becomes progressively harder and may become inadmissible rather than merely expensive.",
      "Gravitational shear and lensing planes create route geography; branch or fork conditions can become destructive for lane-coupled methods.",
      "Safety sensing, prediction horizon, redundancy and emergency intervention capability must advance with transit maturity.",
      "Range, speed and efficiency improvements must be causally attributable to mathematical, field-control, material, structural, energy, navigation, scale/distribution, control, recovery or infrastructure advances rather than unexplained tier bonuses.",
      "The same resolved technology record must support engineering, educational, manual, scientific-history and provenance views."
    ]
  },
  "upgradeAxes": ["MATHEMATICS","FIELD_CONTROL","ACTIVE_MATERIALS","STRUCTURE","ENERGY","NAVIGATION","DRIVE_SCALE_DISTRIBUTION","CONTROL_BANDWIDTH","RECOVERY","INFRASTRUCTURE"],
  "families": [
    {
      "id": "inertial-torch",
      "operatorClass": "CAUSAL_ACCELERATION",
      "distanceModelType": "ORDINARY_TRAJECTORY",
      "primitiveLimitation": "Low exhaust velocity, poor mass ratio and heat rejection make high delta-v prohibitively expensive.",
      "matureObjective": "Increase exhaust velocity, thrust-specific power, heat rejection and relativistic navigation while preserving continuous causal travel.",
      "modelRefs": ["common.ordinary-geodesic-separation.v1", "common.total-transit-time.v1"],
      "transitions": [
        {"from":"p0","to":"p1","mathematicalAdvance":"replace low-energy impulsive trajectory planning with sustained finite-burn optimization","physicalAdvance":"fusion-pulse acceleration spine and stronger pulse structure","drivers":["MATHEMATICS","ENERGY","STRUCTURE"],"changedTerms":["effective exhaust velocity","burn duration","mass ratio"],"effects":[{"output":"SAFE_RANGE","direction":"EXPAND","cause":"higher usable delta-v"},{"output":"ACTIVE_TIME","direction":"DECREASE","cause":"higher sustained acceleration"}],"status":"MIXED"},
        {"from":"p1","to":"p2","mathematicalAdvance":"optimize thrust profile with variable high-energy pulse yield","physicalAdvance":"antimatter-catalyzed ignition and improved magnetic/nozzle containment","drivers":["ENERGY","FIELD_CONTROL","ACTIVE_MATERIALS"],"changedTerms":["exhaust velocity","specific impulse","containment loss"],"effects":[{"output":"SOURCE_BURDEN","direction":"DECREASE","cause":"more momentum per unit carried reaction mass"},{"output":"SAFE_RANGE","direction":"EXPAND","cause":"larger achievable delta-v"}],"status":"MIXED"},
        {"from":"p2","to":"p3","mathematicalAdvance":"include relativistic trajectory and time-dilation terms in mission solution","physicalAdvance":"courier-scale high-flux torch with stronger shielding and thermal routing","drivers":["MATHEMATICS","STRUCTURE","ENERGY","NAVIGATION"],"changedTerms":["gamma factor","proper-time solution","heat flux"],"effects":[{"output":"EQUIVALENT_SPEED","direction":"INCREASE","cause":"higher sustained cruise velocity"},{"output":"ENDPOINT_UNCERTAINTY","direction":"DECREASE","cause":"relativistic navigation model"}],"status":"MIXED"},
        {"from":"p3","to":"p4","mathematicalAdvance":"fleet-scale continuous optimal-control solution with reserve and encounter constraints","physicalAdvance":"redundant torch clusters and distributed heat rejection","drivers":["DRIVE_SCALE_DISTRIBUTION","CONTROL_BANDWIDTH","RECOVERY","STRUCTURE"],"changedTerms":["engine-out tolerance","reserve delta-v","thermal duty cycle"],"effects":[{"output":"LOSS_RISK","direction":"DECREASE","cause":"redundant propulsion and thermal paths"},{"output":"PAYLOAD_CAPACITY","direction":"INCREASE","cause":"distributed thrust structure"}],"status":"DERIVED"},
        {"from":"p4","to":"p5","mathematicalAdvance":"near-light route planning includes encounter probability, radiation environment and braking authority","physicalAdvance":"field-coupled relativistic torch and strategic energy plant","drivers":["MATHEMATICS","FIELD_CONTROL","ENERGY","NAVIGATION"],"changedTerms":["cruise gamma","interaction cross-section","braking reserve"],"effects":[{"output":"EQUIVALENT_SPEED","direction":"INCREASE","cause":"higher practical cruise fraction of c"},{"output":"SAFE_RANGE","direction":"EXPAND","cause":"strategic endurance and braking authority"}],"status":"DERIVED"},
        {"from":"p5","to":"p6","mathematicalAdvance":"adaptive relativistic trajectory replanning under dynamic hazards","physicalAdvance":"compact mature torch, self-calibrating fields and high-density thermal systems","drivers":["MATHEMATICS","ACTIVE_MATERIALS","DRIVE_SCALE_DISTRIBUTION","CONTROL_BANDWIDTH"],"changedTerms":["power density","control latency","engine mass fraction"],"effects":[{"output":"MACHINERY_DENSITY","direction":"IMPROVE","cause":"same propulsion authority in smaller machinery volume"},{"output":"CYCLE_RATE","direction":"INCREASE","cause":"better thermal recovery and control"}],"status":"DERIVED"}
      ]
    },
    {
      "id": "metric-envelope",
      "operatorClass": "METRIC_DEFORMATION",
      "distanceModelType": "EFFECTIVE_METRIC_GEODESIC",
      "primitiveLimitation": "Only small, nearly static metric perturbations can be solved and held without intolerable gradients or loss of closure.",
      "matureObjective": "Maximize useful geodesic shortening per unit field stress while retaining a closed, low-tidal, controllable and recoverable envelope.",
      "modelRefs": ["metric.metric-perturbation.v1","metric.effective-distance.v1","metric.compression-ratio.v1","metric.gradient-penalty.v1"],
      "transitions": [
        {"from":"p0","to":"p1","mathematicalAdvance":"solve directed longitudinal compression and inertial-relief terms instead of one static perturbation","physicalAdvance":"better emitter symmetry, timing and active supports","drivers":["MATHEMATICS","FIELD_CONTROL","STRUCTURE","CONTROL_BANDWIDTH"],"changedTerms":["chi_M","field symmetry","P_grad"],"effects":[{"output":"ROUTE_GAIN","direction":"INCREASE","cause":"greater controlled metric shortening"},{"output":"SOURCE_BURDEN","direction":"DECREASE","cause":"less wasted curvature in uncontrolled modes"}],"status":"DERIVED"},
        {"from":"p1","to":"p2","mathematicalAdvance":"close the field as a moving three-dimensional boundary-value problem around the complete hull","physicalAdvance":"whole-hull emitter coverage, stronger active material and radiation recovery","drivers":["MATHEMATICS","FIELD_CONTROL","ACTIVE_MATERIALS","STRUCTURE","RECOVERY"],"changedTerms":["coverage residual","boundary leakage","radiation storage"],"effects":[{"output":"PAYLOAD_CAPACITY","direction":"INCREASE","cause":"macroscopic hull becomes a valid protected volume"},{"output":"LOSS_RISK","direction":"DECREASE","cause":"complete field closure"}],"status":"DERIVED"},
        {"from":"p2","to":"p3","mathematicalAdvance":"add causal-horizon constraints and reject solutions that lose termination authority","physicalAdvance":"higher field density, horizon sensing and faster control","drivers":["MATHEMATICS","FIELD_CONTROL","ENERGY","NAVIGATION","CONTROL_BANDWIDTH"],"changedTerms":["horizon margin","chi_M","termination authority"],"effects":[{"output":"EQUIVALENT_SPEED","direction":"INCREASE","cause":"admissible solutions cross the c-equivalent boundary"},{"output":"LOSS_RISK","direction":"DECREASE","cause":"unsafe horizon-forming solutions are excluded"}],"status":"DERIVED"},
        {"from":"p3","to":"p4","mathematicalAdvance":"solve time-dependent multi-sector tensor control under hull flex, cargo motion and external perturbation","physicalAdvance":"distributed field sectors and fleet-grade sensing","drivers":["MATHEMATICS","DRIVE_SCALE_DISTRIBUTION","NAVIGATION","CONTROL_BANDWIDTH","STRUCTURE"],"changedTerms":["sector residual","dynamic covariance","coverage reserve"],"effects":[{"output":"SAFE_RANGE","direction":"EXPAND","cause":"solution remains stable over longer dynamic routes"},{"output":"PAYLOAD_CAPACITY","direction":"INCREASE","cause":"larger flexible hulls can be compensated"}],"status":"DERIVED"},
        {"from":"p4","to":"p5","mathematicalAdvance":"optimize a time-varying metric route through heterogeneous gravitational terrain rather than maximizing local compression","physicalAdvance":"strategic energy storage, predictive gravity sensing and durable field structures","drivers":["MATHEMATICS","NAVIGATION","ENERGY","FIELD_CONTROL","ACTIVE_MATERIALS"],"changedTerms":["route functional","eta_g","burden per chi"],"effects":[{"output":"SAFE_RANGE","direction":"EXPAND","cause":"route avoids expensive/high-risk curvature terrain"},{"output":"SOURCE_BURDEN","direction":"DECREASE","cause":"higher useful distance reduction per unit imposed field stress"}],"status":"DERIVED"},